name,source,status,is_vip,no_of_employees,city,score,qualification_status,explain
Lead A - Công ty phần mềm,Website,Open,1,51-200,Ho Chi Minh City,85,Qualified,"Dựa vào các combo trong combo_feature_stats, chúng ta thấy rằng nhiều combo quan trọng như ['source', 'is_vip'], ['is_vip', 'no_of_employees'], ['status', 'is_vip', 'no_of_employees'] nghiêng về nhãn Qualified. Đặc biệt, combo ['source', 'is_vip'] với 150 bản ghi Qualified và combo ['is_vip', 'no_of_employees'] với 253 bản ghi Qualified cho thấy sự ủng hộ mạnh mẽ cho nhãn Qualified. Ngoài ra, với is_vip = 1, chúng ta có thể yên tâm chọn nhãn Qualified khi không có nhiều combo mạnh nghiêng về Junk. Do đó, điểm số được chọn là 85, phản ánh mức độ chắc chắn cao cho nhãn Qualified."
Lead B - Chuỗi bán lẻ,Facebook Ads,Replied,0,201-500,Hanoi,55,Unqualified,"Dựa vào các combo trong combo_feature_stats, không có combo nào ủng hộ rõ rệt cho Qualified, đồng thời không có nhiều combo nghiêng mạnh về Junk. Combo [""status"", ""is_vip""] với giá trị [""Replied"", 0] cho thấy số lượng Unqualified (740) lớn hơn số lượng Qualified (594), trong khi combo [""status"", ""no_of_employees""] với giá trị [""Replied"", ""201-500""] và combo [""is_vip"", ""no_of_employees""] với giá trị [0, ""201-500""] cũng không cho thấy sự chênh lệch rõ ràng giữa Unqualified và Qualified. Do đó, chọn nhãn Unqualified với điểm 55, phản ánh sự không chắc chắn và tín hiệu yếu trong dữ liệu."
Lead C - Startup nhỏ,Referral,Open,0,1-10,Da Nang,55,Unqualified,"Dựa trên dữ liệu combo_feature_stats, không có combo nào nghiêng rõ rệt về Qualified. Hầu hết các combo quan trọng chứa is_vip, no_of_employees đều không cho thấy số lượng Qualified lớn hơn rõ rệt hai nhãn còn lại. Đặc biệt, combo {'features': ['source', 'status', 'is_vip', 'no_of_employees'], 'values': ['Referral', 'Open', 0, '1-10']} có tổng số lượng bản ghi là 138 và số lượng Unqualified là 54, lớn hơn số lượng Qualified là 35. Do đó, nhãn Unqualified được chọn với điểm 55, phản ánh sự trung tính của tín hiệu từ các combo."
Lead D - Tập đoàn sản xuất,Email Campaign,Converted,1,1000,Ho Chi Minh City,80,Qualified,"Dựa trên combo_feature_stats, có 1 combo nghiêng về Qualified với số lượng Qualified (250) lớn hơn rõ rệt so với Junk (73) và Unqualified (62). Vì is_vip = 1 và không có nhiều combo mạnh nghiêng về Junk, nên Qualified là ứng viên chính. Điểm số 80 được chọn do có nhiều combo ủng hộ rõ rệt cho Qualified."
Lead E - Công ty dịch vụ,Event,Open,0,11-50,Can Tho,60,Unqualified,"Dựa trên dữ liệu combo_feature_stats, không có nhiều combo mạnh nghiêng về Qualified và cũng không có nhóm combo nào nghiêng mạnh về Junk. Phần lớn combo cho thấy số lượng Unqualified lớn hơn hoặc tương đương với Qualified, đặc biệt là các combo chứa các trường quan trọng như is_vip và no_of_employees. Do đó, chọn nhãn Unqualified với điểm 60, phản ánh mức độ trung tính và thiếu thông tin rõ ràng nghiêng về Qualified hoặc Junk."
,,,0,,,50,Unqualified,"Dựa trên thông tin lead hiện tại và thống kê toàn cục, không có thông tin cụ thể nào về lead này. Vì không có dữ liệu combo_feature_stats nào được cung cấp, nên không thể xác định được tín hiệu mạnh về bất kỳ nhãn nào. Theo quy tắc bảo thủ, khi không có thông tin cụ thể, ưu tiên chọn Unqualified. Điểm được chọn ở mức trung bình (50) do không có tín hiệu rõ ràng về bất kỳ nhãn nào."
